375,Albert Bichot Chablis Grand Cru les Vaudésirs Domaine Long Depaquit,France,"Burgundy (4.828234, 46.839000)",Albert Bichot,Chardonnay,14.99,2006,White Wine,3.5,2,92
376,Domaine des Malandes Chablis,France,"Burgundy (4.828234, 46.839000)",Domaine des Malandes,Chardonnay,22.99,2005,White Wine,4,4,90
377,Domaine Laroche Chablis les Clos,France,"Burgundy (4.828234, 46.839000)",Domaine Laroche,Chardonnay,33.42,2005,White Wine,3.5,2.25,90
378,Domaine des Malandes Chablis Premiere Cru Montmains,France,"Burgundy (4.828234, 46.839000)",Domaine des Malandes,Chardonnay,35.99,2005,White Wine,3.5,0,89
379,Domaine Francois Raveneau Grand Cru Valmur Chablis Ml,France,"Burgundy (4.828234, 46.839000)",Francois Raveneau Vineyard,Chardonnay,325,2004,White Wine,4,2.833333333,95
381,Domaine Humbert Gevrey Chambertin Poisse,France,"Burgundy (4.828234, 46.839000)",Domaine Humbert Frères,Pinot Noir,61.99,2005,Red Wine,3.5,4.25,88
384,Nicolas Feuillatte Rose,France,"Champagne (3.850451, 49.233237)",Nicolas Feuillatte,Rosé,29.97,2000,Sparkling Wine,4,4.25,92
385,Nicolas Feuillatte Champagne Blend Champagne Cuvée 225 Brut,France,"Champagne (3.850451, 49.233237)",Nicolas Feuillatte,Chardonnay,33.99,2004,White Wine,3.5,3.333333333,90
380,Domaine Christian Moreau Père et Fils Chablis Premiere Cru Cuvée Guy Moreau Vaillons,France,"Burgundy (4.828234, 46.839000)",Domaine Christian Moreau Père et Fils,Chardonnay,58.98,2004,White Wine,4,4.5,93.5
382,Domaine Denis Bachelet Gevrey-Chambertin les Corbeaux Premiere Cru Vieilles Vignes,France,"Burgundy (4.828234, 46.839000)",Domaine Denis Bachelet,Pinot Noir,69.99,2004,Red Wine,3.5,2.25,90
383,Gevrey Chambertin 1 Cru Cazetiersdomaine Louis Jadot Frankrig Bourgogne,France,"Burgundy (4.828234, 46.839000)",Maison Louis Jadot,Pinot Noir,69.99,2005,Red Wine,3.5,3.5,88.5
386,Piper-Heidsieck Champagne Blend Champagne Cuvée Rare,France,"Champagne (3.850451, 49.233237)",Piper-Heidsieck,Champagne,35.99,2009,Sparkling Wine,3.5,3.166666667,88.5
387,Duval-Leroy Champagne Blend Champagne Brut,France,"Champagne (3.850451, 49.233237)",Duval-Leroy,Champagne,36.99,2008,Sparkling Wine,3.5,3.875,90.66666667
388,Michel Dervin Champagne Blend Champagne Brut,France,"Champagne (3.850451, 49.233237)",Michel Dervin,Champagne,32.99,2001,Sparkling Wine,3.5,3.833333333,85
389,Louis Jadot Bourgogne Domaine des Heritiers Louis Jadot Chardonnay Corton-Charlemagne Ac Grd Cru,France,"Burgundy (4.828234, 46.839000)",Maison Louis Jadot,Chardonnay,189.56,2000,White Wine,4,2.5,90
390,Jadot Chassagne Montrachet la Romanee,France,"Burgundy (4.828234, 46.839000)",Maison Louis Jadot,Pinot Noir,59.99,2002,Red Wine,4,2.8,93.5
391,Louis Jadot Clos Vougeot Grand Cru a Selection of Wines Or Other Items France Cote de Nuits Pinot Noir,France,"Burgundy (4.828234, 46.839000)",Maison Louis Jadot,Pinot Noir,149,2005,Red Wine,4,4.25,94
392,Guigal Condrieu,France,"Rhône (4.905138, 45.152446)",E. Guigal,Viognier,69.69,2005,White Wine,4,4.75,94
394,Château les Ollieux Romanis Corbières Cuvée Florence,France,"Languedoc-Roussillon (3.234202, 43.537080)",Château les Ollieux Romanis,Carignane,16.99,2007,Red Wine,3,2.166666667,87
395,Domaine de Nizas Grenache Blend Coteaux du Languedoc Rosé,France,"Languedoc-Roussillon (3.234202, 43.537080)",Domaine de Nizas,Grenache,13.99,2010,Rosé Wine,3,3.5,88
396,Chï¿½teau l'Hospitalet,France,"Languedoc-Roussillon (3.234202, 43.537080)",Château l'Hospitalet,Syrah,20.85,2007,Red Wine,3.5,4,87
397,Prieuré Saint-Jean de Bébian Red Rhone Blend Coteaux du Languedoc,France,"Languedoc-Roussillon (3.234202, 43.537080)",Prieuré Saint-Jean de Bébian,Rhône Blend,26.99,2001,Red Wine,4,4.25,91
398,Château la Roque Coteaux du Languedoc,France,"Languedoc-Roussillon (3.234202, 43.537080)",Château La Roque,Rhône Blend,50.62,2001,White Wine,3.5,1.75,88.33333333
399,Domaine Alain Graillot Crozes Hermitage Daryl Wine Shop,France,"Rhône (4.905138, 45.152446)",Domaine Alain Graillot,Syrah,29.99,2006,Red Wine,4,4,92
400,Alain Graillot Syrah Crozes-Hermitage,France,"Rhône (4.905138, 45.152446)",Domaine Alain Graillot,Syrah,49,2004,Red Wine,3.5,4.75,90.33333333
401,Dom René Rostaing les Picaudières Crozes Hermitage,France,"Rhône (4.905138, 45.152446)",Rene Rostaing,Syrah,89.99,2005,Red Wine,4,4.25,93
427,Château Cabezac Minervois Tradition,France,"Languedoc-Roussillon (3.234202, 43.537080)",Château Cabézac,Syrah,24.99,2003,Red Wine,3.5,4.25,89
402,Crozes-Hermitage 'Les Meysonniers'Ac M. Chapoutier Tain Ecocert Frankreich Côtes du Rhône Septentrionale Chapoutier Michel,France,"Rhône (4.905138, 45.152446)",M. Chapoutier,Syrah,157.16,2001,Red Wine,4,3.833333333,92
403,Château Péby Faugères Saint-Émillion Grand Cru,France,"Bordeaux (-0.434217, 44.966195)",Chateau Faugères,Merlot,15.5,2002,Red Wine,3.5,3.25,89.33333333
404,Ricardo. Chateau -Château les Trois Croix Ac -Bordeaux-Rotweine Frankreich-Weine-Wein & Genuss,France,"Bordeaux (-0.434217, 44.966195)",Château Les Trois Croix,Bordeaux Blend,29.49,1999,Red Wine,3.5,4,86
405,Perrin & Fils Gigondas,France,"Rhône (4.905138, 45.152446)",Famille Perrin,Grenache,29.99,2005,Red Wine,3.5,3.5,93
406,Domaine les Pallieres Gigondas,France,"Rhône (4.905138, 45.152446)",Domaine les Pallieres,Rhône Blend,32.99,2004,Red Wine,4,4.333333333,88
407,Chateau de Saint Cosme Gigondas,France,"Rhône (4.905138, 45.152446)",Château de Saint-Cosme,Rhône Blend,46.7,2004,Red Wine,4,3.2,91.5
408,Domaine Joblot Givry Clos de la Servoisine Premiere Cru,France,"Burgundy (4.828234, 46.839000)",Domaine Joblot,Chardonnay,42.99,2005,White Wine,4,4.333333333,89
409,Château Cabezac Minervois Belvèze Grand Cuvée,France,"Languedoc-Roussillon (3.234202, 43.537080)",Château Cabézac,Syrah,29.99,2002,Red Wine,4,3.75,94
410,Château Villa Bel-Air Sémillon-Sauvignon Blanc Blend Graves Blanc,France,"Bordeaux (-0.434217, 44.966195)",Château Villa Bel-Air,Sémillon,12,2003,White Wine,3,4.25,79
411,Château de Callac Red Bordeaux Blend Graves Prestige,France,"Bordeaux (-0.434217, 44.966195)",Château de Callac,Bordeaux Blend,18.39,2005,White Wine,3,2.25,85
412,Château la Prade Red Bordeaux Blend Côtes de Francs,France,"Bordeaux (-0.434217, 44.966195)",Château La Prade,Bordeaux Blend,32.11,2005,Red Wine,4,3.75,89
413,Château la Grave a Pomerol Trigant a Boisset,France,"Bordeaux (-0.434217, 44.966195)",Bischöfliches Priesterseminar Trier,Merlot,31.34,2002,Red Wine,3.5,4,87
414,Chateau de Cruzeau Pessac-Leognan,France,"Bordeaux (-0.434217, 44.966195)",Château de Cruzeau,Bordeaux Blend,29.99,2009,White Wine,3.5,3.75,90
415,Paul Jaboulet Aine Hermitage la Chapelle,France,"Rhône (4.905138, 45.152446)",Paul Jaboulet Aèné,Syrah,44.95,2007,Red Wine,3,2,90
416,Paul Jaboulet Aîné Hermitage la Chapelle,France,"Rhône (4.905138, 45.152446)",Paul Jaboulet Aèné,Syrah,55.9,1996,Red Wine,3.5,2,90.66666667
417,Paul Joboulet Aene Hermitage Domaine de Thalabert,France,"Rhône (4.905138, 45.152446)",Paul Jaboulet Aèné,Syrah,55.5,2005,Red Wine,3.5,2.2,91
418,Château de Ségriès Lirac,France,"Rhône (4.905138, 45.152446)",Château de Ségriès,Rhône Blend,19.49,2006,Red Wine,3.5,3.666666667,90
419,Château Dauzac Red Bordeaux Blend Margaux,France,"Bordeaux (-0.434217, 44.966195)",Château Dauzac,Bordeaux Blend,41.92,1999,Red Wine,3.5,3.833333333,88.5
420,Chateau D Issan Jéroboam,France,"Bordeaux (-0.434217, 44.966195)",Château d'Issan,Bordeaux Blend,44.71,1996,Red Wine,3.5,0,89
421,Bruno Clair Marsannay les Vaudenelles,France,"Burgundy (4.828234, 46.839000)",Domaine Bruno Clair,Pinot Noir,16.9,2004,Red Wine,3.5,4.25,85
422,Mercurey Wit Chât. de Chamirey A. Rodet Fonds de Cave,France,"Burgundy (4.828234, 46.839000)",Château De Chamirey,Mission,46.54,2004,White Wine,3.5,4,85.5
423,Meursault L.jadot France Burgundy White,France,"Burgundy (4.828234, 46.839000)",Maison Louis Jadot,Chardonnay,44.99,2005,White Wine,4,4.25,95.5
424,Louis Jadot Meursault,France,"Burgundy (4.828234, 46.839000)",Maison Louis Jadot,Chardonnay,49.99,2002,White Wine,4,4.75,89
425,Château Coupe Roses Red Rhone Blend Minervois Cuvée Vignals,France,"Languedoc-Roussillon (3.234202, 43.537080)",Château Coupe-Roses,Grenache,15.95,2005,Red Wine,3.5,3.75,89
428,Château de Puligny Montrachet Monthélie les Duresses Premiere Cru,France,"Burgundy (4.828234, 46.839000)",Château de Puligny Montrachet,Pinot Noir,42.91,2005,Red Wine,3,4,79
429,Joseph Drouhin Puligny-Montrachet,France,"Burgundy (4.828234, 46.839000)",Joseph Drouhin,Chardonnay,61.49,2005,White Wine,4,3.75,89
430,Jean Grivot Nuits St Georges Ronciere France-Burgundy Red,France,"Burgundy (4.828234, 46.839000)",Domaine Jean Grivot,Pinot Noir,65,2009,Red Wine,4,4.333333333,86.5
431,Beaune Les Grèves Premier Cru,France,"Burgundy (4.828234, 46.839000)",Grivot,Pinot Noir,84,2006,Red Wine,4,4.5,92
432,Chateau Haut Bages Monpelou Pauillac France Bordeaux Vin Rouge Cabernet Franc Cabernet Sauvignon Merlot Haut Médoc,France,"Bordeaux (-0.434217, 44.966195)",Château Haut-Bages Libéral,Cabernet Sauvignon,19.99,2006,Red Wine,3.5,3.2,90.5
433,Latour Pauillac,France,"Bordeaux (-0.434217, 44.966195)",Louis Latour,Bordeaux Blend,20.15,2006,Red Wine,3.5,3.75,90
434,Château Grand-Puy-Lacoste 5e Grand Cru Pauillac Aoc,France,"Bordeaux (-0.434217, 44.966195)",Domaine du Mas Blanc - S.C.A Docteur Parcé & Fils Propriétaire,Bordeaux Blend,44.99,2004,Sparkling Wine,4,3.75,89.66666667
435,Chateau Clerc Milon,France,"Bordeaux (-0.434217, 44.966195)",Château Clerc-milon,Cabernet Sauvignon,39.87,2007,Red Wine,3.5,3.333333333,88
436,Château Lynch-Bages Red Bordeaux Blend Pauillac,France,"Bordeaux (-0.434217, 44.966195)",Château Lynch-bages,Bordeaux Blend,49.99,2009,Sparkling Wine,4,3.166666667,97
437,Château Lynch-Moussas Red Bordeaux Blend Pauillac,France,"Bordeaux (-0.434217, 44.966195)",Château Lynch-Moussas,Bordeaux Blend,49.99,2003,Red Wine,4,4,89
438,Château Lynch-Moussas Red Bordeaux Blend Pauillac,France,"Bordeaux (-0.434217, 44.966195)",Château Lynch-Moussas,Bordeaux Blend,41.82,2006,Red Wine,3,3,88.5
439,Château Grand-Puy-Lacoste Red Bordeaux Blend Pauillac,France,"Bordeaux (-0.434217, 44.966195)",Château Grand-Puy-Lacoste,Bordeaux Blend,58.77,2006,Red Wine,4,3.833333333,89.5
440,Réserve de la Comtesse Red Bordeaux Blend Pauillac,France,"Bordeaux (-0.434217, 44.966195)","chateau pichon, longueville, de lalande",Bordeaux Blend,54.14,2004,Red Wine,3,3,88
441,Haut Batailley,France,"Bordeaux (-0.434217, 44.966195)",Château Haut Batailley,Bordeaux Blend,59.89,2002,Red Wine,3.5,4.5,87
442,Château Haut-Bages Libéral Red Bordeaux Blend Pauillac,France,"Bordeaux (-0.434217, 44.966195)",Château Haut-Bages Libéral,Cabernet Sauvignon,59.97,2003,Red Wine,3.5,1.75,89
443,Château Haut-Bages Averous Red Bordeaux Blend Pauillac,France,"Bordeaux (-0.434217, 44.966195)",Château Haut-Bages Averous,Bordeaux Blend,70.9,2003,White Wine,4,4.875,92.75
444,Domaine Aleth Girardin Pommard,France,"Burgundy (4.828234, 46.839000)",Domaine Vincent Girardin,Pinot Noir,77,2005,Red Wine,4,4.5,92
445,Anjou Blanc Château de Passavant-Bio France Val de Loire Anjou Blanc,France,"Loire (0.389758, 47.407122)",Château de Passavant,Chenin Blanc,5.7,2005,White Wine,3.5,3.6,90
446,Joseph Drouhin Beaujolais Nouveau,France,"Burgundy (4.828234, 46.839000)",Joseph Drouhin,Gamay,18,2007,Red Wine,3,3.375,84
447,Savigny les Beaune Clos des Guettes,France,"Burgundy (4.828234, 46.839000)",Maison Louis Jadot,Pinot Noir,54.99,2006,Red Wine,4,3.318181818,95
449,Chanson Pere et Fils Beaune Clos des Mouches,France,"Burgundy (4.828234, 46.839000)",Chanson Père et Fils,Pinot Noir,54.95,2005,Red Wine,4,2.777777778,89.66666667
450,Louis Latour Beaune Premiere Cru Vignes Franches,France,"Burgundy (4.828234, 46.839000)",Louis Latour,Pinot Noir,58.22,2005,Red Wine,4,4,89
451,Domaine Parent Beaune Premiere Cru les Epenottes,France,"Burgundy (4.828234, 46.839000)",Domaine Parent,Pinot Noir,60.49,2002,Red Wine,4,4.25,89
448,Bouchard Pere et Fils Beaune Clos de la Mousse Premier Cru France Cote de Beaune Table Wine,France,"Burgundy (4.828234, 46.839000)",Bouchard Père et Fils,Pinot Noir,47.64,2006,Red Wine,3.5,3.666666667,87
452,Jadot Louis Domaine des Heritiers Beaune-Boucherottes Premier Cru,France,"Burgundy (4.828234, 46.839000)",Maison Louis Jadot,Pinot Noir,62.69,2005,Red Wine,4,2.666666667,91
453,Handcraft Petite Sirah,France,"Bordeaux (-0.434217, 44.966195)",Handcraft Wines,Petite Sirah,12.99,2010,Red Wine,3.5,3.833333333,90
454,Cameron Hughes Merlot Puisseguin-St. Émilion,France,"Bordeaux (-0.434217, 44.966195)",Cameron Hughes Wine,Merlot,12.99,2005,White Wine,3.5,3.75,85
455,Château Rieussec Sémillon-Sauvignon Blanc Blend Sauternes,France,"Bordeaux (-0.434217, 44.966195)",Château Rieussec,Bordeaux Blend,15.99,2007,Dessert/Fortified,4,2.25,94.33333333
456,Barton & Guestier Cabernet Sauvignon Bordeaux Contrôlée,France,"Rhône (4.905138, 45.152446)",Barton&Guestier,Merlot,11.99,2009,Red Wine,3,4.1,86
457,Château Picampeau Red Bordeaux Blend Lussac-St. Émilion,France,"Bordeaux (-0.434217, 44.966195)",Château Picampeau,Merlot,12.99,2005,Red Wine,3,3.666666667,84
458,Château de Macard Red Bordeaux Blend Bordeaux Supérieur,France,"Bordeaux (-0.434217, 44.966195)",Château de Macard,Bordeaux Blend,14.99,2009,Red Wine,3.5,3.642857143,90
459,Chateau Marjosse Primeurwein Rotwein,France,"Bordeaux (-0.434217, 44.966195)",Château Marjosse,Bordeaux Blend,15.12,2003,Red Wine,3.5,3.5,85
460,Château d'Arcins Red Bordeaux Blend Haut-Médoc Château Tour du Mayne,France,"Bordeaux (-0.434217, 44.966195)",Château d'Arcins,Bordeaux Blend,15.3,2003,Red Wine,3,4,84
461,Château Beaumont Red Bordeaux Blend Haut-Médoc,France,"Bordeaux (-0.434217, 44.966195)",Château Beaumont,Bordeaux Blend,14.38,2003,Red Wine,3,3.333333333,85
462,Château Larose-Trintaudon Red Bordeaux Blend Haut-Médoc,France,"Bordeaux (-0.434217, 44.966195)",Château Larose-Trintaudon,Bordeaux Blend,19.99,2004,Rosé Wine,3.5,3.25,84
463,Sainte Hélène Mas Belles Eaux France Compagnie Medocaine des Grands Crus,France,"Bordeaux (-0.434217, 44.966195)",Château de Malle,Isabella,19.99,2005,Dessert/Fortified,3.5,3.75,89.5
464,Caronne Ste. Gemme Haut-Médoc,France,"Bordeaux (-0.434217, 44.966195)",Château Caronnes Ste. Gemme,Bordeaux Blend,21.21,1995,Red Wine,3.5,5,89
465,Château Tour de Guiet Red Bordeaux Blend Côtes de Bourg,France,"Bordeaux (-0.434217, 44.966195)",Château Tour de Guiet,bordeaux blend,15.99,2003,Red Wine,3,2,88
466,Chateau Bonnet Bordeaux,France,"Bordeaux (-0.434217, 44.966195)",André Lurton,Bordeaux Blend,16.99,2005,Red Wine,3,2.833333333,87
467,Château de Reignac Sémillon-Sauvignon Blanc Blend Bordeaux Supérieur Blanc,France,"Bordeaux (-0.434217, 44.966195)",Château de Reignac,Bordeaux Blend,21.99,2006,White Wine,4,4,91
468,La Fleur de Château de Cazenove,France,"Bordeaux (-0.434217, 44.966195)",Château de Cazenove,Merlot,19.99,2005,Red Wine,3.5,3,88
469,Cru Bourgeois Exceptionnel Médoc Bordeaux Rouge,France,"Bordeaux (-0.434217, 44.966195)",L'Exceptionnel,Bordeaux Blend,20.37,2006,Red Wine,3.5,3.333333333,85
470,Medoc Greysac Wines  Red,France,"Bordeaux (-0.434217, 44.966195)",Château Greysac,Petit Verdot,19.99,2008,Red Wine,3.5,3.5,86.5
471,Olivier Leflaive Bourgogne les Setilles,France,"Burgundy (4.828234, 46.839000)",Olivier Leflaive,Négrette,23.99,2005,White Wine,3.5,3.5,86
472,Joseph Drouhin Laforet Bourgogne Pinot Noir France,France,"Burgundy (4.828234, 46.839000)",Joseph Drouhin,Pinot Noir,32.29,2006,Red Wine,3.5,3.8,86.5
473,Joseph Drouhin Pinot Noir Bourgogne Véro,France,"Burgundy (4.828234, 46.839000)",Joseph Drouhin,Pinot Noir,46.58,2002,Red Wine,3.5,3.833333333,92.25
499,Woodbridge Merlot,USA,"California (-122.387185, 38.406418)",Woodbridge by Robert Mondavi,Merlot,2.3,2001,Red Wine,3.5,3.25,79
500,Luna Vineyards Pinot Grigio Napa Valley,USA,"California (-122.387185, 38.406418)",Luna Vineyards,Pinot Grigio,2.5,2005,White Wine,3.5,3.75,90
474,Bourgogne Rouge Cuvée Chantal Cru-Lage Von Gevrey-Chambertin. Die Weinbereitung Ist Eher Traditionell. Nach Einer Kaltmazeration Von,France,"Burgundy (4.828234, 46.839000)","R. López de Heredia Viña Tondonia, S.A.",Pinot Noir,74.99,2008,Red Wine,3.5,1.75,93
475,Louis Jadot Savigny les Beaune Clos des Guettes Blanc Savigny les Beaune Bourgogne-Bouteille,France,"Burgundy (4.828234, 46.839000)",Maison Louis Jadot,Pinot Noir,215,2003,White Wine,4,3.75,93.2
476,Fevre William Chablis Bougros Cote Bouguerots -Domaine -Mg,France,"Burgundy (4.828234, 46.839000)",Viña William Fèvre,Chardonnay,71.99,2005,White Wine,4,3.666666667,94
477,Drouhin Chablis,France,"Burgundy (4.828234, 46.839000)",Joseph Drouhin,Chardonnay,78,2005,Red Wine,4,3.833333333,91.33333333
478,Fevre. William-Chablis Bougros Cotes de Bouguerots Cs Fevre William-Chablis Bougros Cotes de Bouguerots White White Burgundy Chablis White Burgundy White,France,"Burgundy (4.828234, 46.839000)",Viña William Fèvre,Chardonnay,79.99,2009,White Wine,4,3.875,88.5
479,Domaine Armand Rousseau Gevrey Chambertin Clos St Jacques,France,"Burgundy (4.828234, 46.839000)",Domaine Armand Rousseau Père et Fils,Pinot Noir,227.94,2000,Red Wine,4,4.5,90
480,Montaudon Champagne Blend Champagne Brut,France,"Champagne (3.850451, 49.233237)",Montaudon,Champagne,37.89,2010,Sparkling Wine,3.5,4,88
481,Veuve Clicquot Brut Champagne Rare,France,"Champagne (3.850451, 49.233237)",Veuve Clicquot Ponsardin,Champagne,47,1988,Sparkling Wine,4,4.666666667,93.2
482,Duval-Leroy Brut Blanc de Chardonnay,France,"Champagne (3.850451, 49.233237)",Duval-Leroy,Chardonnay,51.07,1998,Sparkling Wine,4,4.5,91
484,Henriot Brut,France,"Champagne (3.850451, 49.233237)",Henriot,Champagne,48.39,1996,Sparkling Wine,3.5,4,91.2
485,Champagne Veuve Clicquot Ponsardin Demi-Sec,France,"Champagne (3.850451, 49.233237)",Veuve Clicquot Ponsardin,Champagne,54.99,2010,Sparkling Wine,3.5,4,90.5
486,Charles Heidsieck Brut Reserve Champagne Original Presentation Box,France,"Champagne (3.850451, 49.233237)",Charles Heidsieck,Champagne,59.99,2008,Sparkling Wine,4,3.875,92
487,Pol Roger Champagne Blend Champagne Selection Brut,France,"Champagne (3.850451, 49.233237)",Pol Roger,Champagne,59.99,2000,Sparkling Wine,3.5,3.125,91
488,Ayala Blanc de Blancs Champagne Blend Wine,France,"Champagne (3.850451, 49.233237)",Ayala,Chardonnay,68.49,2004,Sparkling Wine,4,5,90.75
490,Veuve Clicquot Gold Label Brut,France,"Champagne (3.850451, 49.233237)",Veuve Clicquot Ponsardin,Champagne,79.99,2004,Sparkling Wine,4,3.8,92
491,Perrier-Jouët Champagne Blend Champagne Cuvée Fleur de Champagne Rosé,France,"Champagne (3.850451, 49.233237)",Perrier-Jouët,Chardonnay,84.99,2006,White Wine,4,4.75,90.5
492,Chartron & Trébuchet Bienvenues-Bâtard-Montrachet,France,"Burgundy (4.828234, 46.839000)",Chartron et Trébuchet,Chardonnay,79,1999,White Wine,3,3.666666667,93
493,Domaine Leflaive Puligny-Montrachet les Pucelles Premiere Cru,France,"Burgundy (4.828234, 46.839000)",Domaine Leflaive,Chardonnay,256.33,2005,White Wine,4,3.333333333,93
494,Domaine Leflaive Bâtard-Montrachet,France,"Burgundy (4.828234, 46.839000)",Domaine Leflaive,Chardonnay,316.3,2004,White Wine,4,4.75,95
495,Louis Latour Inc. Latour Grand Echezeaux Grand Cru,France,"Burgundy (4.828234, 46.839000)",Louis Latour,Vivant,285.82,2005,White Wine,3.5,2.863636364,91
501,Columbia Crest Chardonnay Columbia Valley Two Vines,USA,"Washington (-121.460951, 47.963348)",Columbia Crest,Chardonnay,5.37,2008,White Wine,4,3.333333333,89
502,Bennett Lane Maximus,USA,"California (-122.387185, 38.406418)",Bennett Lane Winery,Syrah,6.04,2005,Red Wine,4,3.6875,90
503,Benziger Family Winery Fumé Blanc North Coast,USA,"California (-122.387185, 38.406418)",Benziger Family Winery,Sauvignon Blanc,5.49,2001,White Wine,3.5,3.1,97
504,Cline Cellars Viognier Sonoma County,USA,"California (-122.387185, 38.406418)",Cline Cellars,Viognier,5.99,1997,White Wine,3.5,4,87
506,Columbia Crest Merlot Columbia Valley Grand Estates,USA,"Washington (-121.460951, 47.963348)",Columbia Crest,Merlot,6.99,2004,Red Wine,4,3.538461538,88.5
507,Columbia Crest Merlot Columbia Valley Reserve,USA,"Washington (-121.460951, 47.963348)",Columbia Crest,Merlot,6.99,2002,Red Wine,3.5,3.833333333,90.33333333
509,Barefoot Cellars Zinfandel California,USA,"California (-122.387185, 38.406418)",Barefoot Cellars,Zinfandel,6.49,2004,Red Wine,3,3.192307692,86
510,Redwood Creek Chardonnay,USA,"California (-122.387185, 38.406418)",Redwood Creek,Chardonnay,6.79,2005,White Wine,3,3,82
511,Columbia Crest Cabernet Sauvignon 'Two Vines' Premier,USA,"Washington (-121.460951, 47.963348)",Columbia Crest,Cabernet Sauvignon,6.99,2009,Red Wine,3.5,3.464285714,90
512,Beringer Napa Valley Merlot,USA,"California (-122.387185, 38.406418)",Beringer Vineyards,Merlot,7.99,2001,Red Wine,4,3.875,89
513,Don Sebastiani & Sons Cabernet Sauvignon Napa Valley Smoking Loon,USA,"California (-122.387185, 38.406418)",Don Sebastiani & Sons,Cabernet Sauvignon,6.97,2005,Red Wine,3,3.369565217,85
514,Cooper Mountain Vineyards Pinot Gris Willamette Valley Reserve,USA,"Oregon (-121.746595, 44.687298)",Cooper Mountain Vineyards,Pinot Grigio,8.99,2008,White Wine,4,4.75,89
515,Ravenswood Zinfandel Sonoma B,USA,"California (-122.387185, 38.406418)",Ravenswood Winery,Zinfandel,7.99,2008,Red Wine,3,3.333333333,92.33333333
516,Rancho Zabaco Zinfandel California Dancing Bull,USA,"California (-122.387185, 38.406418)",Rancho Zabaco Winery,Zinfandel,8.41,2006,Red Wine,3,3.4,84
517,Bubo Zinfandel Old Vine,USA,"California (-122.387185, 38.406418)",Bubo,Zinfandel,6.79,2009,Red Wine,2.5,2.75,83
518,Sebastiani Sonoma County Zinfandel,USA,"California (-122.387185, 38.406418)",Don Sebastiani & Sons,Zinfandel,7.99,2007,Red Wine,3,3,86
519,Bogle Essential Red,USA,"California (-122.387185, 38.406418)",Bogle Vineyards,Cabernet Sauvignon,8.99,2011,Red Wine,3,3.46,83
520,Columbia Crest Merlot Columbia Valley Two Vines,USA,"Oregon (-121.746595, 44.687298)",Columbia Crest,Merlot,7.99,2007,Red Wine,3.5,3.692307692,89.5
521,Beringer Merlot-California 15/Cs Usa,USA,"California (-122.387185, 38.406418)",Beringer Vineyards,Merlot,6.97,2007,Red Wine,3,3,90
522,Beringer Vineyards Merlot Napa Valley,USA,"California (-122.387185, 38.406418)",Beringer Vineyards,Merlot,7.99,2011,Red Wine,3,3.6,92.5
523,Hogue Cellars Fumé Blanc Columbia Valley,USA,"Oregon (-121.746595, 44.687298)",Hogue Cellars,Sauvignon Blanc,7.98,2005,White Wine,3,3.2,87
524,Jean Jean Chardonnay Vin de Pays d'Oc Region House,USA,"Texas (-98.670593, 31.871728)",Stonehouse Vineyard,Chardonnay,8,2004,White Wine,3.5,4,86
525,Bogle Chardonnay California,USA,"California (-122.387185, 38.406418)",Bogle Vineyards,Chardonnay,7.99,2011,White Wine,3,4,85
526,Barefoot Pinot Noir,USA,"California (-122.387185, 38.406418)",Barefoot Cellars,Pinot Noir,5.99,2009,Red Wine,2.5,2.772727273,83
527,Mirassou Vineyards Pinot Noir California,USA,"California (-122.387185, 38.406418)",Mirassou Vineyards,Pinot Noir,7.97,2011,Red Wine,3,3.34375,80
528,Echelon Pinot Noir Central Coast,USA,"California (-122.387185, 38.406418)",Echelon Vineyards,Pinot Noir,7.99,2007,Red Wine,3,3.875,86
529,Valley of the Moon Pinot Noir,USA,"California (-122.387185, 38.406418)",Valley of the Moon Winery,Pinot Noir,9.99,2009,Red Wine,3.5,3.75,89
530,Bogle Vineyards Pinot Noir Russian River Valley,USA,"California (-122.387185, 38.406418)",Bogle Vineyards,Pinot Noir,9.99,2003,Red Wine,3.5,3.625,81
531,Leese-Fitch Pinot Noir,USA,"California (-122.387185, 38.406418)",The Other Guys,Pinot Noir,10.99,2009,Red Wine,3.5,3.875,90
532,Toulouse Vineyards Pinot Noir Anderson Valley Rosé of Pinot Noir,USA,"California (-122.387185, 38.406418)",Toulouse Vineyards,Pinot Noir,11.16,2007,Rosé Wine,3.5,3.75,91
533,Robert Mondavi Moscato d'Oro,USA,"Texas (-98.670593, 31.871728)",Robert Mondavi Winery,Muscat Blanc,10.63,2011,Dessert/Fortified,4,3.561403509,91
534,Eos Tears of Dew Late Harvest Moscato,USA,"California (-122.387185, 38.406418)",EOS Estate Winery,Muscat Blanc,26.39,2006,Dessert/Fortified,4,4,95
535,Beringer Vineyards Cabernet Sauvignon Howell Mountain Steinhauer Ranch,USA,"California (-122.387185, 38.406418)",Beringer Vineyards,Cabernet Sauvignon,8.99,2009,Red Wine,3.5,3.25,93
536,Chateau Ste. Michelle Dry Riesling,USA,"Oregon (-121.746595, 44.687298)",Chateau Ste. Michelle,Riesling,7.99,2011,White Wine,3.5,3.75,84
537,Columbia Crest Syrah Columbia Valley Grand Estates,USA,"Oregon (-121.746595, 44.687298)",Columbia Crest,Syrah,8.37,2008,Red Wine,3,3.333333333,87.5
538,Columbia Crest Cabernet Sauvignon Columbia Valley Grand Estates,USA,"Oregon (-121.746595, 44.687298)",Columbia Crest,Cabernet Sauvignon,9.99,2001,Red Wine,3.5,2.9,89.66666667
539,Willamette Valley Vineyards Riesling Oregon Willamette Valley Klaffke Forrest,USA,"Oregon (-121.746595, 44.687298)",Willamette Valley Vineyards,Riesling,9.99,2009,White Wine,3.5,3.5,88
540,Pacific Rim Riesling,USA,"Oregon (-121.746595, 44.687298)",Pacific Rim,Riesling,9.99,2011,White Wine,3,3.25,88
541,Pacific Rim Riesling,USA,"Oregon (-121.746595, 44.687298)",Pacific Rim,Riesling,10.99,2010,White Wine,3.5,3.666666667,90
542,Matanzas Creek Pinot Noir Sonoma County Quail Hill Ranch,USA,"California (-122.387185, 38.406418)",Matanzas Creek Winery,Pinot Noir,9,1980,Red Wine,3,2,82
543,Sonoma Vineyards Cabernet Sauvignon Alexander Valley Alexander's Crown Vineyard,USA,"California (-122.387185, 38.406418)",Sonoma Vineyards,Cabernet Sauvignon,95,1975,Red Wine,2,2.3,82
544,David Bruce Cabernet Sauvignon Santa Clara Valley,USA,"California (-122.387185, 38.406418)",David Bruce Winery,Cabernet Sauvignon,34.99,1999,Red Wine,3,3.25,86
545,Carignan,USA,"California (-122.387185, 38.406418)",Chateau Carignan,Carignane,17.99,2003,Red Wine,3.5,4.375,88
546,Pine Ridge Chenin Blanc-Viognier California,USA,"California (-122.387185, 38.406418)",Pine Ridge Vineyard,Chenin Blanc,59.99,1999,Red Wine,3.5,3.375,93.66666667
