3,Château Pirouette Red Bordeaux Blend Médoc,France,"Bordeaux (-0.434217, 44.966195)",Pirouette,Bordeaux Blend,55.5,2005,Red Wine,3.5,3,91
4,Cameron Hughes Lot 99,USA,"California (-122.387185, 38.406418)",Cameron Hughes Wine,Cabernet Sauvignon,10,2004,Red Wine,3,3.388888889,86
5,Château Cadillac Sémillon-Sauvignon Blanc Blend Bordeaux Contrôlée,France,"Bordeaux (-0.434217, 44.966195)",Chateau Cadillac,Bordeaux Blend,9.99,2005,Red Wine,2.5,2.666666667,85
6,Château de Flaugergues Red Rhone Blend Coteaux du Languedoc la Méjanelle,France,"Languedoc-Roussillon (3.234202, 43.537080)",Château de Flaugergues,Syrah,11.99,2007,Red Wine,3,3.75,91
8,Didier Champalou Vouvray,France,"Loire (0.389758, 47.407122)",E.A.R.L. Champalou,Chenin Blanc,12.99,2007,White Wine,3.5,3.375,90
9,Nicolas Potel Vosne-Romanée les Gaudichots Premiere Cru,France,"Burgundy (4.828234, 46.839000)",Nicolas Potel,Pinot Noir,48.99,2005,Red Wine,4,0,92
10,Laurent-Perrier Rose Cuvee Alexandra Grand Siecle,France,"Champagne (3.850451, 49.233237)",Laurent-Perrier,Pinot Noir,89.99,1997,Sparkling Wine,4,5,91
11,Delamotte Blancs de Blancs,France,"Champagne (3.850451, 49.233237)",Delamotte,Pinot Noir,93,1999,Sparkling Wine,4,4,91
12,Château Beaulieu Comtes de Tastes,France,"Bordeaux (-0.434217, 44.966195)",Château de Beaulieu,Merlot,17.99,2003,Red Wine,3.5,1.625,89
13,Château de Reignac Sémillon-Sauvignon Blanc Blend Bordeaux Supérieur Blanc,France,"Bordeaux (-0.434217, 44.966195)",Château de Reignac,Sauvignon Blanc,42.99,2005,Red Wine,4,3.611111111,91.33333333
14,Château Moulin de la Roquille Red Bordeaux Blend Côtes de Francs,France,"Bordeaux (-0.434217, 44.966195)",Chateau Moulin de la Roquille,Merlot,17.99,2005,Red Wine,2.5,2.5,86
15,Château Haut Nadeau Red Bordeaux Blend Bordeaux Supérieur Cuvée Prestige,France,"Bordeaux (-0.434217, 44.966195)",Château Haut Nadeau,Bordeaux Blend,14.99,2005,Red Wine,3,2.708333333,87
16,Château le Bonnat Red Bordeaux Blend Graves,France,"Bordeaux (-0.434217, 44.966195)",Chateau Le Bonnat,Merlot,19,2005,Red Wine,3,3.285714286,87
17,Domaine Marc Kreydenweiss Pinot Blanc,France,"Alsace (7.366076, 47.954467)",Domaine Marc Kreydenweiss,Pinot Blanc,23.99,2005,White Wine,3,3.285714286,88.5
18,Saint-Amour Aoc,France,"Burgundy (4.828234, 46.839000)",Georges Duboeuf,Gamay,23.99,2005,Red Wine,3.5,3.565217391,90
19,Fleurie Clos de la Roilette Coudert,France,"Burgundy (4.828234, 46.839000)",Coudert Pere Et Fils,Gamay,19.99,2007,Red Wine,3.5,3.25,89
23,Juslyn Spring Mountain Estate,USA,"California (-122.387185, 38.406418)",Juslyn Vineyards,Cabernet Sauvignon,85.99,2003,Red Wine,4,4.5,89
24,Corinne & Thierry Drouin La Roche,France,"Burgundy (4.828234, 46.839000)",Domaine Corinne & Thierry Drouin,Chardonnay,25,2007,White Wine,3.5,4,88
20,Château de Lamarque Haut-Médoc Cru Bourgeois Supérieur Vin Rouge Vin Tranquille France Bordeaux A.o.c.-cru Bourgeois Sc Gromand d'Evry,France,"Bordeaux (-0.434217, 44.966195)",Sociedade Agrícola Do Vale Da Vilariç,Bordeaux Blend,33.12,2000,Red Wine,4,4.7,89
22,Gallo Family Vineyards Cabernet Sauvignon Dry Creek Valley Frei Ranch,USA,"California (-122.387185, 38.406418)",Gallo Family Vineyards,Cabernet Sauvignon,11.99,2003,Red Wine,3.5,3.166666667,89
25,Red Bicyclette French Rosé,France,"Languedoc-Roussillon (3.234202, 43.537080)",Red Bicyclette,Rosé,8.09,2005,Rosé Wine,3,2.75,76
26,Château Moyau Rosé Blend Coteaux du Languedoc la Clape,France,"Languedoc-Roussillon (3.234202, 43.537080)",Chateau Moyau,Grenache,16,2007,Rosé Wine,3.5,3.6,89
27,Fleurie Chateau du Chatelard Red,France,"Burgundy (4.828234, 46.839000)",Chateau du Chatelard,Gamay,14.26,2007,Red Wine,2.5,3,83
28,Xavier Flouret Marly,France,"Burgundy (4.828234, 46.839000)",Xavier Flouret,Chardonnay,24.99,2009,White Wine,3.5,3.75,87
29,Xavier Flouret Marly,France,"Burgundy (4.828234, 46.839000)",Xavier Flouret,Chardonnay,24.99,2008,White Wine,4,4.125,88
30,Lang & Reed Cabernet Franc North Coast Red Shed,USA,"California (-122.387185, 38.406418)",Lang & Reed Wine Co.,Bordeaux Blend,80,2004,Red Wine,4,4,90
31,Reignac Red Bordeaux Blend Bordeaux Supérieur,France,"Bordeaux (-0.434217, 44.966195)",Reignac,Bordeaux Blend,52.8,2000,Red Wine,4,1,90
32,Clos la Coutale Cahors 12b-1,France,"South West (1.685129, 43.910241)",Clos La Coutale,Malbec,16.99,2007,Red Wine,3,3.25,90
33,Bordeaux,France,"Bordeaux (-0.434217, 44.966195)",Mouton-cadet,Bordeaux Blend,14.39,2008,Red Wine,3.5,3.666666667,92
34,Coteaux du Languedoc,France,"Languedoc-Roussillon (3.234202, 43.537080)",Domaine de Nizas,Syrah,14.99,2006,Red Wine,3.5,1.166666667,90
35,Regnie Mommessin Mommessin,France,"Burgundy (4.828234, 46.839000)",Mommessin,Gamay,18.99,2005,Red Wine,3,2.5,86
37,Xavier Flouret Pinot Noir Menetou-Salon Rouge Noir,France,"Loire (0.389758, 47.407122)",Xavier Flouret,Pinot Noir,24.99,2006,Red Wine,4,4.166666667,88
38,Continuum,USA,"California (-122.387185, 38.406418)",Continuum,Cabernet Sauvignon,140,2007,Red Wine,4,2.5,96.33333333
68,Breton Bourgeuil Trinch,France,"Loire (0.389758, 47.407122)",Catherine & Pierre Bréton,Cabernet Sauvignon,14.99,2007,Red Wine,3.5,3.9,88
69,Château Thivin Côte de Brouilly,France,"Burgundy (4.828234, 46.839000)",Château Thivin,Gamay,9.59,2006,Red Wine,3.5,4.5,87.5
70,Château de la Chaize Brouilly,France,"Burgundy (4.828234, 46.839000)",Château De La Chaize,Gamay,17.99,2005,Red Wine,3.5,3.375,86
44,Bonneau du Martray Corton Charlemagne Burgundy,France,"Burgundy (4.828234, 46.839000)",Bonneau du Martray,Chardonnay,168.8,2004,White Wine,4,4,93
45,Louis Latour Aloxe Corton Premiere Cru les Chaillots,France,"Burgundy (4.828234, 46.839000)",Louis Latour,Pinot Noir,51.95,2009,Red Wine,3,3.25,91
46,Jadot Corton Greves,France,"Burgundy (4.828234, 46.839000)",Maison Louis Jadot,Pinot Noir,76.89,2010,Red Wine,3.5,2.166666667,89
47,Château de Pibarnon Bandol Blanc,France,"Provence (6.267443, 43.581821)",Château de Pibarnon,Rhône Blend,44.99,2005,White Wine,4,4.25,95
48,Domaine Tempier Bandol Cuvée Spéciale,France,"Provence (6.267443, 43.581821)",Domaine Tempier,Mourvèdre,36,2006,Red Wine,3.5,3.416666667,92.5
49,Louis Jadot Morgon,France,"Burgundy (4.828234, 46.839000)",Maison Louis Jadot,Gamay,53.61,2004,Red Wine,3,3.1,84.5
50,Saint-Amour Ac,France,"Burgundy (4.828234, 46.839000)",Joseph Drouhin,Gamay,20.59,2006,Red Wine,3.5,3.25,91
51,Lapierre Morgon,France,"Burgundy (4.828234, 46.839000)",Marcel Lapierre,Gamay,24.99,2007,Red Wine,2.5,2,84
52,Barton & Guestier Beaujolais-Villages,France,"Burgundy (4.828234, 46.839000)",Barton&Guestier,Gamay,13.5,2009,Red Wine,4,4.5,86
53,Louis Jadot Beaujolais-Villages Combe Aux Jacques & Bourgogne Chardonnay 20 France Maison Louis Jadot,France,"Burgundy (4.828234, 46.839000)",Maison Louis Jadot,Chardonnay,11.99,2009,White Wine,3.5,3.3,88
54,Beaujolais-Villages 'Combe Aux Jacques' L. Jadot,France,"Burgundy (4.828234, 46.839000)",Maison Louis Jadot,Gamay,11.99,2006,Red Wine,3.5,3.476744186,85
55,Louis Jadot Chardonnay Meursault-Blagny Premier Cru,France,"Burgundy (4.828234, 46.839000)",Maison Louis Jadot,Chardonnay,13.25,2009,White Wine,3,2.4,87
56,Château Gigault Red Bordeaux Blend Premières Côtes de Blaye Cuvée Viva,France,"Bordeaux (-0.434217, 44.966195)",Château Petit Védrines,Bordeaux Blend,26.99,2005,Red Wine,3.5,1.75,89
58,Louis Jadot Pinot Noir Bonnes Mares Grand Cru,France,"Burgundy (4.828234, 46.839000)",Maison Louis Jadot,Pinot Noir,219.99,2006,Red Wine,3.5,3.71875,94
59,Louis Jadot Pinot Noir Bonnes Mares Grand Cru,France,"Burgundy (4.828234, 46.839000)",Maison Louis Jadot,Pinot Noir,145,2004,Red Wine,4,4.833333333,90.5
60,Domaine Jacques-Frederic Mugnier Bonnes Mares,France,"Burgundy (4.828234, 46.839000)",Domaine Jacques-Frederic Mugnier,Pinot Noir,251.98,2004,Red Wine,4,4.25,90
61,Château de Fesles Bonnezeaux,France,"Loire (0.389758, 47.407122)",Château de Fesles,Chenin Blanc,49.99,2007,Dessert/Fortified,3.5,4,88
62,Château Doisy-Daëne Grand Vin Sec,France,"Bordeaux (-0.434217, 44.966195)",Château Doisy-Daëne,Sauvignon Blanc,49,2005,White Wine,4,4.333333333,91
63,Le Blanc du Château Prieuré-Lichine,France,"Bordeaux (-0.434217, 44.966195)",Château Prieuré-lichine,Sauvignon Blanc,71.64,1998,Red Wine,3.5,5,87
65,Le Blanc du Château Prieuré-Lichine,France,"Bordeaux (-0.434217, 44.966195)",Château Prieuré-lichine,Sauvignon Blanc,59.99,2004,White Wine,3.5,3.444444444,89.75
66,Mischief and Mayhem Chardonnay Bourgogne Blanc,France,"Burgundy (4.828234, 46.839000)",Mischief and Mayhem,Chardonnay,71.59,2009,White Wine,3,3.375,88
67,Frederic Mabileau Saint-Nicolas-de-Bourgueil les Rouilleres,France,"Loire (0.389758, 47.407122)",Frederic Mabileau,Cabernet Sauvignon,13.99,2005,Red Wine,3.5,2.833333333,91
64,Le Blanc du Château Prieuré-Lichine,France,"Bordeaux (-0.434217, 44.966195)",Domaine du Mas Blanc - S.C.A Docteur Parcé & Fils Propriétaire,Sauvignon Blanc,62.88,2002,White Wine,3,3,88.33333333
71,Les Vignerons de Buzet Red Bordeaux Blend Buzet Baron d'Ardeuil,France,"South West (1.685129, 43.910241)",Les Vignerons de Buzet,Bordeaux Blend,16.99,2000,Red Wine,3.5,3.1,85
73,Château de Pennautier Red Blend Cabardès l'Esprit de Pennautier,France,"Languedoc-Roussillon (3.234202, 43.537080)",Château de Pennautier,Syrah,18.17,2004,Red Wine,3,2.666666667,78
74,Château de Haute-Serre Malbec Blend Cahors,France,"South West (1.685129, 43.910241)",Château de Haute-Serre,Malbec,21.99,2002,Red Wine,3.5,3.875,88
75,Château Vrai Canon Bouché Red Bordeaux Blend Canon-Fronsac,France,"Bordeaux (-0.434217, 44.966195)",Château Vrai Canon Bouché,Merlot,142.99,2003,Red Wine,3.5,4.25,90.5
76,Château du Gazin Red Bordeaux Blend Canon-Fronsac,France,"Bordeaux (-0.434217, 44.966195)",Château du Gazin,Bordeaux Blend,94.22,2001,Red Wine,4,4.1,90.25
77,William Fevre Champ Royaux Chablis,France,"Burgundy (4.828234, 46.839000)",Viña William Fèvre,Chardonnay,25.99,2011,White Wine,3.5,3.75,88
78,Domaine Christian Moreau Pere et Fils Chablis Grand Cru les Clos,France,"Burgundy (4.828234, 46.839000)",Domaine Christian Moreau Père et Fils,Chardonnay,93.79,2006,White Wine,4,4.166666667,93
79,Domaine Christian Moreau Chablis Premier Cru Vaillon Cuvée Guy Moreau,France,"Burgundy (4.828234, 46.839000)",Domaine Christian Moreau Père et Fils,Chardonnay,92.01,2008,White Wine,3.5,3.916666667,92.33333333
80,Moreau Fils J. & Chablis Domaine de Biéville,France,"Burgundy (4.828234, 46.839000)",Domaine de Bieville,Chardonnay,61.23,2005,White Wine,3.5,3.5,92
81,Moreau Chablis',France,"Burgundy (4.828234, 46.839000)",Domaine Christian Moreau Père et Fils,Chardonnay,24.99,2009,White Wine,3.5,2.333333333,90.2
82,Domaine William Fevre Chablis Grand Cru les Clos,France,"Burgundy (4.828234, 46.839000)",Viña William Fèvre,Chardonnay,95,2006,White Wine,4,4,96.5
83,Domaine William Fevre Grand Cru Bougros Cote Bouguerots Chablis Ml,France,"Burgundy (4.828234, 46.839000)",Viña William Fèvre,Chardonnay,76.15,2004,White Wine,4,1.666666667,94.5
84,Verget Chablis Grand Cru Bougros,France,"Burgundy (4.828234, 46.839000)",Verget Maison,Chardonnay,48,1999,White Wine,3.5,4.5,89
85,Domaine Billaud-Simon Chablis Grand Cru Vaudésir,France,"Burgundy (4.828234, 46.839000)",Domaine Billaud-simon,Chardonnay,72.34,2002,White Wine,4,2.5,92.5
86,Domaine Christian Moreau Pere et Fils Chablis Grand Cru Valmur,France,"Burgundy (4.828234, 46.839000)",Domaine Christian Moreau Père et Fils,Chardonnay,114.64,2006,White Wine,4,4.25,93
87,Maison Albert Bichot Chablis Grand Cru Domaine Long-Depaquit Moutonne,France,"Burgundy (4.828234, 46.839000)",Albert Bichot,Chardonnay,74.99,2006,White Wine,3.5,1.75,91
88,Jadot Chambertin Clos de Beze,France,"Burgundy (4.828234, 46.839000)",Maison Louis Jadot,Pinot Noir,19.99,2009,Red Wine,3.5,3.2,90.5
90,Ayala Champagne Blend Champagne Perle d'Ayala,France,"Champagne (3.850451, 49.233237)",Ayala,Champagne,166.65,2001,Sparkling Wine,4,4.333333333,92
91,Ayala Champagne Blend Champagne Brut,France,"Champagne (3.850451, 49.233237)",Ayala,Pinot Noir,79,1999,Sparkling Wine,4,4.666666667,85
92,Bollinger Champagne Blend Champagne,France,"Champagne (3.850451, 49.233237)",Bollinger,Pinot Noir,134.74,2003,Sparkling Wine,3.5,3.75,93
93,Ayala Champagne Blend Champagne Perle d'Ayala Nature,France,"Champagne (3.850451, 49.233237)",Ayala,Chardonnay,150,2002,Sparkling Wine,4,5,92
94,Dom des Baumaed Chaume,France,"Loire (0.389758, 47.407122)",Domaine des Baumard,Chenin Blanc,22.99,2004,White Wine,4,4,90.33333333
95,Domaine des Baumard Quarts de Chaume,France,"Loire (0.389758, 47.407122)",Domaine des Baumard,Chenin Blanc,124.99,1995,White Wine,4,4.25,98
96,Baumard Quarts de Chaume,France,"Loire (0.389758, 47.407122)",Domaine des Baumard,Chenin Blanc,77.03,2005,Dessert/Fortified,4.5,5,94.25
98,Bouchard Pere et Fils Chevalier Montrachet France-Bordeaux-Dry White,France,"Burgundy (4.828234, 46.839000)",Bouchard Père et Fils,Bordeaux Blend,17.99,2009,Red Wine,3,3,91.5
99,Bouchard Pere et Fils Chevalier-Montrachet Grand Cru Double,France,"Burgundy (4.828234, 46.839000)",Bouchard Père et Fils,Chardonnay,114.33,2008,Red Wine,4,4.166666667,92
100,Louis Latour Chevalier-Montrachet les Demoiselles,France,"Burgundy (4.828234, 46.839000)",Louis Latour,Chardonnay,186,1995,White Wine,4.5,4.666666667,98
101,Chevalier-Montrachet Demoiselles Héritiers Jadot Frankrig-Bourgogne,France,"Burgundy (4.828234, 46.839000)",Maison Louis Jadot,Chardonnay,45,1999,Red Wine,3.5,4.25,89.5
102,Bouchard Pere & Fils Chevalier Montrachet,France,"Burgundy (4.828234, 46.839000)",Bouchard Père et Fils,Chardonnay,96.08,2003,White Wine,3.5,3.5,88.66666667
103,Chevalier Montrachet Grand Cru Domaine Bouchard Père et Fils,France,"Burgundy (4.828234, 46.839000)",Bouchard Père et Fils,Chardonnay,124.99,2004,White Wine,4,4.166666667,92
104,O. Raffault Chinon Les Picasses,France,"Loire (0.389758, 47.407122)",Olga Raffault,Cabernet Sauvignon,34.95,2002,Red Wine,3.5,3.5,88.5
105,Domaine de Pallus Chinon,France,"Loire (0.389758, 47.407122)",Pallus Chinon,Cabernet Sauvignon,19.99,2007,Red Wine,3.5,3.5,90
106,Remy Pannier Cabernet Franc Chinon,France,"Loire (0.389758, 47.407122)",Remy Wines,Cabernet Sauvignon,20.99,2007,Red Wine,3,3,88
107,Couly Dutheil Chinon Gravieres,France,"Loire (0.389758, 47.407122)",Couly-Dutheil,Cabernet Sauvignon,21.31,2004,Red Wine,3.5,1.75,89
108,Domaine Bernard Baudry Chinon,France,"Loire (0.389758, 47.407122)",Domaine Bernard Baudry,Cabernet Sauvignon,39.28,2005,Rosé Wine,4,3.25,91.25
109,Domaine de la Noblaie Chinon,France,"Loire (0.389758, 47.407122)",Domaine de la Noblaie,Cabernet Sauvignon,18.69,2006,Red Wine,3.5,3.75,90
110,Georges Duboeuf Chiroubles,France,"Burgundy (4.828234, 46.839000)",Georges Duboeuf,Gamay,12.69,2010,Red Wine,2.5,2.75,88
111,Saint-Cosme Red Rhone Blend Côtes du Rhône,France,"Rhône (4.905138, 45.152446)",Château de Saint-Cosme,Viognier,81.93,2005,Red Wine,4,4.333333333,90.33333333
112,Guigal la Doriane Condrieu,France,"Rhône (4.905138, 45.152446)",E. Guigal,Viognier,73.74,2006,White Wine,4,3.875,96.25
113,Paul Jaboulet Aîné Condrieu,France,"Rhône (4.905138, 45.152446)",Paul Jaboulet Aèné,Viognier,100.73,1999,White Wine,3.5,3.666666667,92.33333333
114,E. Guigal Viognier Condrieu la Doriane,France,"Rhône (4.905138, 45.152446)",E. Guigal,Viognier,43.99,2004,White Wine,4,3.75,92.5
115,Les Deux Rives Corbieres Rouge,France,"Languedoc-Roussillon (3.234202, 43.537080)",Domaine Les Deux Rives,Grenache,4.99,2007,Red Wine,3.5,3.375,85.5
116,Domaine Lignères Mourvedre Blend Corbières las Vals,France,"Languedoc-Roussillon (3.234202, 43.537080)",Domaine Lignères,Mourvèdre,16.19,2003,White Wine,3.5,3.25,90
117,Deux Rives Corbieres Rouge,France,"Languedoc-Roussillon (3.234202, 43.537080)",Domaine Les Deux Rives,Carignane,10.99,2008,Red Wine,3,3,87
118,Paul Jaboulet Aîné Cornas,France,"Rhône (4.905138, 45.152446)",Paul Jaboulet Aèné,Syrah,150,2001,Red Wine,3,3.5,88
119,Cornas Pierre Gaillard,France,"Rhône (4.905138, 45.152446)",Pierre Morey,Syrah,72.82,2006,Red Wine,4,4.25,93
120,Auguste Clape Cornas Aoc,France,"Rhône (4.905138, 45.152446)",Domaine Auguste Clape,Syrah,98.83,2004,Red Wine,4,4,92
121,Thierry and Guy Pinot Noir Fat Bastard,France,"Alsace (7.366076, 47.954467)",Thierry and Guy,Pinot Noir,9.36,2009,Red Wine,3,2.5,85
122,Camille Giroud Corton,France,"Burgundy (4.828234, 46.839000)",Camille Giroud,Pinot Noir,245,1978,Red Wine,3.5,0,93
123,Bollinger Grande Annee Brut Champagne,France,"Champagne (3.850451, 49.233237)",Bollinger,Champagne,336.13,1990,Sparkling Wine,4.5,3.625,95.2
124,Bollinger Special Cuvee Brut Ga & Rd 3 Bottles,France,"Champagne (3.850451, 49.233237)",Bollinger,Pinot Noir,234.4,1996,Sparkling Wine,4.5,4.5,94.66666667
125,Domaine des Baumard Coteaux du Layon Carte d'Or,France,"Loire (0.389758, 47.407122)",Domaine des Baumard,Chenin Blanc,29.99,2005,Dessert/Fortified,4,4.5,91.25
126,Domaine de Bellivière Coteaux du Loir Le Rouge-Gorge,France,"Loire (0.389758, 47.407122)",Domaine de Bellivière,Pineau d'Aunis,18.37,2004,Red Wine,3.5,3.5,89
127,Chateauneuf du Pape Barbe Rac Grande Cuvee M. Chapoutier Trocken Frankreich Rhône /Td Châteauneuf-du-Pape M. Chapoutier,France,"Rhône (4.905138, 45.152446)",M. Chapoutier,Syrah,199.97,2004,Red Wine,4,3.666666667,93.33333333
129,Guigal E. Crozes-Hermitage,France,"Rhône (4.905138, 45.152446)",E. Guigal,Grenache,21.99,2009,White Wine,3.5,3.666666667,92
130,Cave de Tain Crozes-Hermitage White,France,"Rhône (4.905138, 45.152446)",Cave de Tain,Marsanne,18.99,2009,White Wine,4,3.5,90
131,Cave de Tain l'Hermitage Crozes-Hermitage les Hauts du Fief,France,"Rhône (4.905138, 45.152446)",Cave de Tain,Syrah,29.99,2006,Red Wine,3.5,3.333333333,90
132,Delas Frères Syrah Crozes-Hermitage les Launes,France,"Rhône (4.905138, 45.152446)",Delas Frères,Syrah,120.35,1999,White Wine,3.5,4.75,92
133,Delas Freres Crozes Hermitage 'Les Launes',France,"Rhône (4.905138, 45.152446)",Delas Frères,Syrah,20.69,2009,Red Wine,3.5,3.5,91
134,Jean-Luc Colombo Syrah Vin de Pays d'Oc la Violette,France,"Rhône (4.905138, 45.152446)",Jean-Luc Colombo,Syrah,93.79,2006,Red Wine,3.5,4.5,91
135,E. Guigal White Rhone Blend Côtes du Rhône Blanc,France,"Rhône (4.905138, 45.152446)",E. Guigal,Grenache,359.95,2004,White Wine,4,3.5,92.8
137,Chateau Bonnet,France,"Bordeaux (-0.434217, 44.966195)",André Lurton,Sémillon,13.99,2008,Red Wine,3,3.25,87
138,Chateau Bonnet Entre-Deux-Mers,France,"Bordeaux (-0.434217, 44.966195)",André Lurton,Bordeaux Blend,15.99,2010,Red Wine,3.5,4,86
139,Château Bonnet Entre-Deux-Mers Blanc,France,"Bordeaux (-0.434217, 44.966195)",André Lurton,Sémillon,91.89,2003,White Wine,2.5,1.75,86
140,Domaine Maria Fita Fitou,France,"Languedoc-Roussillon (3.234202, 43.537080)",Domaine Maria Fita,Rhône Blend,23.99,2002,Red Wine,3.5,3.5,88
136,Blanc Crozes-Hermitage 'Petite Ruche' Aoc Mo M. Chapoutier Tain Frankreich Côtes du Rhône Septentrionale Chapoutier Michel,France,"Rhône (4.905138, 45.152446)",M. Chapoutier,Rhône Blend,169.99,2005,Red Wine,3.5,3.388888889,90
141,Fleurie Aoc,France,"Burgundy (4.828234, 46.839000)",Georges Duboeuf,Gamay,15.39,2008,Red Wine,3,2.857142857,90
142,Henry Fessy Fleurie Gamay Burgundy France,France,"Burgundy (4.828234, 46.839000)",Henry Fessy,Gamay,16.99,2009,Red Wine,3.5,2.9,91
143,J. Vidal-Fleury Red Rhone Blend Côtes du Rhône,France,"Rhône (4.905138, 45.152446)",J. Vidal-Fleury,Rhône Blend,9.99,2006,Red Wine,3.5,2.944444444,83
144,Coudert Fleurie Clos de la Roilette,France,"Burgundy (4.828234, 46.839000)",Coudert,Gamay,21,2003,Red Wine,3.5,3.25,91
145,Vidal-Fleury Cotes-du-Rhone,France,"Rhône (4.905138, 45.152446)",J. Vidal-Fleury,Rhône Blend,12.99,1999,Red Wine,3,3.5,86
146,Château Fontenil Red Bordeaux Blend Fronsac,France,"Bordeaux (-0.434217, 44.966195)",Château Fontenil,Merlot,40.16,2000,Red Wine,4,3.75,91
147,Château la Vieille Cure Red Bordeaux Blend Fronsac,France,"Bordeaux (-0.434217, 44.966195)",Château La Vieille Cure,Bordeaux Blend,31.91,2004,Red Wine,3.5,3.875,90
148,Château la Vieille Cure Red Bordeaux Blend Fronsac,France,"Bordeaux (-0.434217, 44.966195)",Château La Vieille Cure,Bordeaux Blend,44.95,2003,Red Wine,4,2.875,92
149,Vignerons de Caractère Gigondas Nectar du Terroir,France,"Rhône (4.905138, 45.152446)",Vignerons de Caractere,Grenache,27.08,2004,Red Wine,3,2.5,86
150,E. Guigal Red Rhone Blend Gigondas,France,"Rhône (4.905138, 45.152446)",E. Guigal,Grenache,14.99,2005,Red Wine,3.5,3.307692308,88.33333333
151,St. Cosme Gigondas Valbelle,France,"Rhône (4.905138, 45.152446)",Château de Saint-Cosme,Marsanne,54.99,2006,Red Wine,4,3.857142857,91.33333333
152,Château de Saint-Cosme Gigondas Valbelle,France,"Rhône (4.905138, 45.152446)",Château de Saint-Cosme,Grenache,87.5,2007,Red Wine,3.5,3.5,100
154,Louis Bernard Red Rhone Blend Côtes du Luberon,France,"Rhône (4.905138, 45.152446)",Louis Bernard,Rhône Blend,38.99,2009,Red Wine,3.5,3.5,88
155,Chateau de Saint Cosme Gigondas,France,"Rhône (4.905138, 45.152446)",Château de Saint-Cosme,Rhône Blend,37.99,2007,Red Wine,3.5,4,93
156,Perrin & Fils Gigondas la Gille,France,"Rhône (4.905138, 45.152446)",Famille Perrin,Grenache,30.63,2007,Red Wine,3.5,3.75,92
157,Eguigal Gigondas,France,"Rhône (4.905138, 45.152446)",E. Guigal,Grenache,25.28,2004,Red Wine,2.5,2.5,88
158,E. Guigal Gigondas Red,France,"Rhône (4.905138, 45.152446)",E. Guigal,Grenache,27.99,2007,Red Wine,3.5,3,90.5
159,La Tour Château Grand Moulin Rosé,France,"Languedoc-Roussillon (3.234202, 43.537080)",Château Batailley,Cabernet Sauvignon,59.39,2006,Red Wine,4,3,89.66666667
160,Château d'Esclans Rosé Blend Côtes de Provence Rosé Whispering Angel,France,"Languedoc-Roussillon (3.234202, 43.537080)",Domaine des Grands Esclans,Rosé,79.4,2008,Rosé Wine,3.5,3.5,92
161,Château Pape Clement White Blend Grand Cru Classe Bordeaux Graves,France,"Bordeaux (-0.434217, 44.966195)",Château Pape-clement,Bordeaux Blend,335.58,2006,White Wine,4.5,1.75,97
162,Chateau de Fieuzal Pessac-Leognan,France,"Bordeaux (-0.434217, 44.966195)",Château de Fieuzal,Cabernet Sauvignon,49.99,2005,Red Wine,4,3.75,91.25
163,Château Carbonnieux Weiss,France,"Bordeaux (-0.434217, 44.966195)",Château Carbonnieux,Sauvignon Blanc,32.99,2004,White Wine,4,4,90
164,Carbonnieux Graves Cru Classé Bordeaux,France,"Bordeaux (-0.434217, 44.966195)",Château Carbonnieux,Bordeaux Blend,55.99,2007,White Wine,4,4.166666667,91.5
165,06nieuw! Carbonnieux Blanc Pessac-Léognan,France,"Bordeaux (-0.434217, 44.966195)",Château Carbonnieux,Sémillon,35,2003,White Wine,3.5,3,91
166,Château Picque Caillou Ac,France,"Bordeaux (-0.434217, 44.966195)",Château Picque Caillou,Merlot,42.23,2000,Red Wine,3.5,2.6,89
167,Clos Floridene Red Bordeaux Blend Graves,France,"Bordeaux (-0.434217, 44.966195)",Clos Floridene,Sémillon,28.88,2006,White Wine,4,4.25,91
168,Jean-Louis Chave Hermitage,France,"Rhône (4.905138, 45.152446)",Domaine Jean-Louis Chave,Bordeaux Blend,225,2006,Red Wine,4,3.928571429,91
169,Jean-Louis Chave Hermitage,France,"Rhône (4.905138, 45.152446)",Domaine Jean-Louis Chave,Syrah,178.57,1996,Red Wine,4,3.25,92.33333333
170,Oro de Castilla Verdejo Rueda,France,"Rhône (4.905138, 45.152446)",Oro de Castilla,Syrah,12.99,2007,Red Wine,2.5,4,83
171,Delas Frères Hermitage Marquise de la Tourette,France,"Rhône (4.905138, 45.152446)",Delas Frères,Syrah,84.99,2007,Red Wine,3,2.88,92.25
172,Delas Freres Hermitage Marquise de la Tourette,France,"Rhône (4.905138, 45.152446)",Delas Frères,Syrah,63.29,2005,Red Wine,4,4,94.5
173,Château la Fleur de Boüard Red Bordeaux Blend Lalande de Pomerol le Plus,France,"Bordeaux (-0.434217, 44.966195)",Château La Fleur de Boüard,Merlot,24.5,2006,Red Wine,4,4.5,90
174,Château Haut-Surget Red Bordeaux Blend Lalande de Pomerol,France,"Bordeaux (-0.434217, 44.966195)",Château Haut-Surget,Bordeaux Blend,29.99,2005,Red Wine,3.5,3.714285714,88
175,Frederic Magnien Latricieres Chambertin,France,"Burgundy (4.828234, 46.839000)",Frédéric Magnien,Pinot Noir,196.62,2005,Red Wine,4,2,90
176,Mas de Gourgonnier Red Rhone Blend les Baux-de-Provence,France,"Provence (6.267443, 43.581821)",Mas de Gourgonnier,Bordeaux Blend,16.99,2007,Red Wine,3,3.214285714,89
177,Gérard Bertrand White Blend,France,"Languedoc-Roussillon (3.234202, 43.537080)",Gérard Bertrand,Viognier,46.21,2005,Red Wine,3.5,3.583333333,88.5
178,Domaine la Lorentine Red Rhone Blend Lirac,France,"Rhône (4.905138, 45.152446)",Domaine la Lorentine,Rhône Blend,18.91,2003,Red Wine,3.5,3,85
179,Domaine Grand Veneur Red Rhone Blend Lirac Clos de Sixte,France,"Rhône (4.905138, 45.152446)",Domaine Grand Veneur,Grenache,27.99,2009,Red Wine,4,4.5,91.5
180,Roger Sabon Lirac Chapelle de Maillac,France,"Rhône (4.905138, 45.152446)",Roger Sabon & Fils,Rhône Blend,239.72,2004,Red Wine,4,4,95
181,Château Mont-Redon Red Rhone Blend Châteauneuf-du-Pape,France,"Rhône (4.905138, 45.152446)",Château Mont-Redon,Rhône Blend,27.22,2003,Red Wine,3.5,4.25,87
182,Bonny Doon Vineyard Syrah Central Coast le Pousseur,France,"South West (1.685129, 43.910241)",Bonny Doon Vineyard,Tannat,22.99,2008,Red Wine,3,1.5,88
183,Château Montus Madiran la Tyre,France,"South West (1.685129, 43.910241)",Château Montus,Tannat,62.08,2001,Red Wine,4,3.875,94
184,Bonny Doon Vineyard Syrah Central Coast le Pousseur,France,"South West (1.685129, 43.910241)",Bonny Doon Vineyard,Tannat,17.99,2004,Red Wine,3,3.083333333,84.75
186,Château Palmer Margaux Alter Ego,France,"Bordeaux (-0.434217, 44.966195)",Chateau Palmer,Cabernet Sauvignon,285.28,2006,Red Wine,4,3.833333333,91.33333333
189,Château Palmer Margaux Bottle,France,"Bordeaux (-0.434217, 44.966195)",Chateau Palmer,Cabernet Sauvignon,286.29,1996,Red Wine,3.5,3.75,90.5
190,Château Palmer 3ème Cru Classé Margaux A.c,France,"Bordeaux (-0.434217, 44.966195)",Chateau Palmer,Merlot,189.97,1979,Red Wine,4,4.25,89
191,Château Palmer Margaux Ex Chateau,France,"Bordeaux (-0.434217, 44.966195)",Chateau Palmer,Cabernet Sauvignon,219.98,1988,Red Wine,3.5,4,91.5
